{
  "app": "WorkDashboard",
  "version": 2,
  "exported_at": "2026-09-02 12:00:00",
  "count": 50,
  "works": [
    {
      "name": "常规工作-7月第01天",
      "work_type": "regular",
      "duration_hours": 7.0,
      "planned_date": "2026-07-01",
      "expected_income": 350,
      "notes": "",
      "status": "done",
      "actual_duration_hours": 7.0,
      "completed_date": "2026-07-01",
      "actual_income": 350,
      "created_at": "2026-09-02 12:00:00",
      "updated_at": "2026-09-02 12:00:00"
    },
    {
      "name": "常规工作-7月第02天",
      "work_type": "regular",
      "duration_hours": 7.0,
      "planned_date": "2026-07-02",
      "expected_income": 350,
      "notes": "",
      "status": "done",
      "actual_duration_hours": 7.0,
      "completed_date": "2026-07-02",
      "actual_income": 350,
      "created_at": "2026-09-02 12:00:00",
      "updated_at": "2026-09-02 12:00:00"
    },
    {
      "name": "常规工作-7月第03天",
      "work_type": "regular",
      "duration_hours": 7.0,
      "planned_date": "2026-07-03",
      "expected_income": 350,
      "notes": "",
      "status": "done",
      "actual_duration_hours": 7.0,
      "completed_date": "2026-07-03",
      "actual_income": 350,
      "created_at": "2026-09-02 12:00:00",
      "updated_at": "2026-09-02 12:00:00"
    },
    {
      "name": "常规工作-7月第04天",
      "work_type": "regular",
      "duration_hours": 7.0,
      "planned_date": "2026-07-06",
      "expected_income": 350,
      "notes": "",
      "status": "done",
      "actual_duration_hours": 7.0,
      "completed_date": "2026-07-06",
      "actual_income": 350,
      "created_at": "2026-09-02 12:00:00",
      "updated_at": "2026-09-02 12:00:00"
    },
    {
      "name": "常规工作-7月第05天",
      "work_type": "regular",
      "duration_hours": 7.0,
      "planned_date": "2026-07-07",
      "expected_income": 350,
      "notes": "",
      "status": "done",
      "actual_duration_hours": 7.0,
      "completed_date": "2026-07-07",
      "actual_income": 350,
      "created_at": "2026-09-02 12:00:00",
      "updated_at": "2026-09-02 12:00:00"
    },
    {
      "name": "常规工作-7月第06天",
      "work_type": "regular",
      "duration_hours": 7.0,
      "planned_date": "2026-07-08",
      "expected_income": 350,
      "notes": "",
      "status": "done",
      "actual_duration_hours": 7.0,
      "completed_date": "2026-07-08",
      "actual_income": 350,
      "created_at": "2026-09-02 12:00:00",
      "updated_at": "2026-09-02 12:00:00"
    },
    {
      "name": "常规工作-7月第07天",
      "work_type": "regular",
      "duration_hours": 7.0,
      "planned_date": "2026-07-09",
      "expected_income": 350,
      "notes": "",
      "status": "done",
      "actual_duration_hours": 7.0,
      "completed_date": "2026-07-09",
      "actual_income": 350,
      "created_at": "2026-09-02 12:00:00",
      "updated_at": "2026-09-02 12:00:00"
    },
    {
      "name": "常规工作-7月第08天",
      "work_type": "regular",
      "duration_hours": 7.0,
      "planned_date": "2026-07-10",
      "expected_income": 350,
      "notes": "",
      "status": "done",
      "actual_duration_hours": 7.0,
      "completed_date": "2026-07-10",
      "actual_income": 350,
      "created_at": "2026-09-02 12:00:00",
      "updated_at": "2026-09-02 12:00:00"
    },
    {
      "name": "常规工作-7月第09天",
      "work_type": "regular",
      "duration_hours": 7.0,
      "planned_date": "2026-07-13",
      "expected_income": 350,
      "notes": "",
      "status": "done",
      "actual_duration_hours": 7.0,
      "completed_date": "2026-07-13",
      "actual_income": 350,
      "created_at": "2026-09-02 12:00:00",
      "updated_at": "2026-09-02 12:00:00"
    },
    {
      "name": "常规工作-7月第10天",
      "work_type": "regular",
      "duration_hours": 7.0,
      "planned_date": "2026-07-14",
      "expected_income": 350,
      "notes": "",
      "status": "done",
      "actual_duration_hours": 7.0,
      "completed_date": "2026-07-14",
      "actual_income": 350,
      "created_at": "2026-09-02 12:00:00",
      "updated_at": "2026-09-02 12:00:00"
    },
    {
      "name": "常规工作-7月第11天",
      "work_type": "regular",
      "duration_hours": 7.0,
      "planned_date": "2026-07-15",
      "expected_income": 350,
      "notes": "",
      "status": "done",
      "actual_duration_hours": 7.0,
      "completed_date": "2026-07-15",
      "actual_income": 350,
      "created_at": "2026-09-02 12:00:00",
      "updated_at": "2026-09-02 12:00:00"
    },
    {
      "name": "常规工作-7月第12天",
      "work_type": "regular",
      "duration_hours": 7.0,
      "planned_date": "2026-07-16",
      "expected_income": 350,
      "notes": "",
      "status": "done",
      "actual_duration_hours": 7.0,
      "completed_date": "2026-07-16",
      "actual_income": 350,
      "created_at": "2026-09-02 12:00:00",
      "updated_at": "2026-09-02 12:00:00"
    },
    {
      "name": "常规工作-7月第13天",
      "work_type": "regular",
      "duration_hours": 7.0,
      "planned_date": "2026-07-17",
      "expected_income": 350,
      "notes": "",
      "status": "done",
      "actual_duration_hours": 7.0,
      "completed_date": "2026-07-17",
      "actual_income": 350,
      "created_at": "2026-09-02 12:00:00",
      "updated_at": "2026-09-02 12:00:00"
    },
    {
      "name": "常规工作-7月第14天",
      "work_type": "regular",
      "duration_hours": 7.0,
      "planned_date": "2026-07-20",
      "expected_income": 350,
      "notes": "",
      "status": "done",
      "actual_duration_hours": 7.0,
      "completed_date": "2026-07-20",
      "actual_income": 350,
      "created_at": "2026-09-02 12:00:00",
      "updated_at": "2026-09-02 12:00:00"
    },
    {
      "name": "常规工作-7月第15天",
      "work_type": "regular",
      "duration_hours": 7.0,
      "planned_date": "2026-07-21",
      "expected_income": 350,
      "notes": "",
      "status": "done",
      "actual_duration_hours": 7.0,
      "completed_date": "2026-07-21",
      "actual_income": 350,
      "created_at": "2026-09-02 12:00:00",
      "updated_at": "2026-09-02 12:00:00"
    },
    {
      "name": "常规工作-7月第16天",
      "work_type": "regular",
      "duration_hours": 7.0,
      "planned_date": "2026-07-22",
      "expected_income": 350,
      "notes": "",
      "status": "done",
      "actual_duration_hours": 7.0,
      "completed_date": "2026-07-22",
      "actual_income": 350,
      "created_at": "2026-09-02 12:00:00",
      "updated_at": "2026-09-02 12:00:00"
    },
    {
      "name": "常规工作-7月第17天",
      "work_type": "regular",
      "duration_hours": 7.0,
      "planned_date": "2026-07-23",
      "expected_income": 350,
      "notes": "",
      "status": "done",
      "actual_duration_hours": 7.0,
      "completed_date": "2026-07-23",
      "actual_income": 350,
      "created_at": "2026-09-02 12:00:00",
      "updated_at": "2026-09-02 12:00:00"
    },
    {
      "name": "常规工作-7月第18天",
      "work_type": "regular",
      "duration_hours": 7.0,
      "planned_date": "2026-07-24",
      "expected_income": 350,
      "notes": "",
      "status": "done",
      "actual_duration_hours": 7.0,
      "completed_date": "2026-07-24",
      "actual_income": 350,
      "created_at": "2026-09-02 12:00:00",
      "updated_at": "2026-09-02 12:00:00"
    },
    {
      "name": "常规工作-7月第19天",
      "work_type": "regular",
      "duration_hours": 7.0,
      "planned_date": "2026-07-27",
      "expected_income": 350,
      "notes": "",
      "status": "done",
      "actual_duration_hours": 7.0,
      "completed_date": "2026-07-27",
      "actual_income": 350,
      "created_at": "2026-09-02 12:00:00",
      "updated_at": "2026-09-02 12:00:00"
    },
    {
      "name": "常规工作-7月第20天",
      "work_type": "regular",
      "duration_hours": 7.0,
      "planned_date": "2026-07-28",
      "expected_income": 350,
      "notes": "",
      "status": "done",
      "actual_duration_hours": 7.0,
      "completed_date": "2026-07-28",
      "actual_income": 350,
      "created_at": "2026-09-02 12:00:00",
      "updated_at": "2026-09-02 12:00:00"
    },
    {
      "name": "常规工作-7月第21天",
      "work_type": "regular",
      "duration_hours": 7.0,
      "planned_date": "2026-07-29",
      "expected_income": 350,
      "notes": "",
      "status": "done",
      "actual_duration_hours": 7.0,
      "completed_date": "2026-07-29",
      "actual_income": 350,
      "created_at": "2026-09-02 12:00:00",
      "updated_at": "2026-09-02 12:00:00"
    },
    {
      "name": "常规工作-7月第22天",
      "work_type": "regular",
      "duration_hours": 7.0,
      "planned_date": "2026-07-30",
      "expected_income": 350,
      "notes": "",
      "status": "done",
      "actual_duration_hours": 7.0,
      "completed_date": "2026-07-30",
      "actual_income": 350,
      "created_at": "2026-09-02 12:00:00",
      "updated_at": "2026-09-02 12:00:00"
    },
    {
      "name": "常规工作-7月第23天",
      "work_type": "regular",
      "duration_hours": 7.0,
      "planned_date": "2026-07-31",
      "expected_income": 350,
      "notes": "",
      "status": "done",
      "actual_duration_hours": 7.0,
      "completed_date": "2026-07-31",
      "actual_income": 350,
      "created_at": "2026-09-02 12:00:00",
      "updated_at": "2026-09-02 12:00:00"
    },
    {
      "name": "其他工作-7月-外包甲",
      "work_type": "other",
      "duration_hours": 4.0,
      "planned_date": "2026-07-06",
      "expected_income": 400,
      "notes": "临时外包",
      "status": "done",
      "actual_duration_hours": 4.0,
      "completed_date": "2026-07-06",
      "actual_income": 400,
      "created_at": "2026-09-02 12:00:00",
      "updated_at": "2026-09-02 12:00:00"
    },
    {
      "name": "其他工作-7月-咨询乙",
      "work_type": "other",
      "duration_hours": 3.0,
      "planned_date": "2026-07-15",
      "expected_income": 300,
      "notes": "远程咨询",
      "status": "done",
      "actual_duration_hours": 3.0,
      "completed_date": "2026-07-15",
      "actual_income": 300,
      "created_at": "2026-09-02 12:00:00",